<?xml version="1.0" encoding="UTF-8" ?>
<golfers xmlns:xsi="http://www.w3.org/2001/XMLSchema-instance" xmlns="http://www.golfExample.com" xsi:schemaLocation="http://www.golfExample.com golfers.xsd">
	<golfer1 skill="excellent" handicap="12" clubs="Taylor Made" id="1111">
		<name>
			<firstName>Paul</firstName>
			<lastName>Allsing</lastName>
		</name>
		<favoriteCourses>
			<course city="Pinetop" state="AZ" name="Pinetop Lakes CC" />
			<course city="Phoenix" state="AZ" name="Ocotillo" />
			<course city="Snowflake" state="AZ" name="Silver Creek" />
		</favoriteCourses>
	</golfer1>
	<golfer skill="moderate" handicap="8" clubs="Taylor Made" id="2222">
		<name>
			<firstName>Dan</firstName>
			<lastName>Wahlin</lastName>
		</name>
		<favoriteCourses>
			<course city="Pinetop" state="AZ" name="Pinetop Lakes CC" />
			<course city="Pinetop" state="AZ" name="White Mountain CC" />
			<course city="Springville" state="UT" name="Hobble Creek" />
		</favoriteCourses>
	</golfer>
</golfers>